{
  "directory_names": [
    null
  ],
  "dns_names": [
    "Production Internet Asset Inventory"
  ],
  "edi_party_names": [
    null
  ],
  "email_addresses": [
    "analyst@example.com"
  ],
  "ip_addresses": [
    "example"
  ],
  "other_names": [
    null,
    null
  ],
  "registered_ids": [
    "example"
  ],
  "uniform_resource_identifiers": [
    "example"
  ]
}